{
  "protocolVersion": "1.0",
  "schemaVersion": 1,
  "eventId": "450436fc-f06c-4b3a-b718-7a21d7fd9657",
  "sessionId": "mob_session_7b7c6d325d234be7b6cba379ad12c659",
  "type": "SET_COMPLETED",
  "timestamp": 1784102580000,
  "source": "WATCH",
  "deviceId": "watch-gt4-debug-001",
  "revision": 8,
  "payload": {
    "setId": "mob_set_34599d14fb234ff2837ad7dc453ec21a"
  }
}
